{
  "spec": "1.12.0",
  "$comment": "Locale resolution input. Algorithm is specified in spec/rules/locale-resolution.md and is identical in every runtime — never delegate it to a platform locale-negotiation library. \"spec\" here must track spec/VERSION exactly — it is not itself the global version source; scripts/validate-spec.mjs enforces the match.",
  "locales": [
    "en-US",
    "en-GB",
    "de-DE",
    "de-CH",
    "fr",
    "fr-CA",
    "ru",
    "fi",
    "sv",
    "el",
    "es",
    "it",
    "pt-PT",
    "pt-BR",
    "nl",
    "pl",
    "uk",
    "cs",
    "tr",
    "sk",
    "ro",
    "hu"
  ],
  "aliases": {
    "en": "en-US",
    "de": "de-DE",
    "pt": "pt-PT"
  }
}
